{
  "fingerprint_version": "0.1.0",
  "detected_at": "2026-04-14T16:20:00Z",
  "source": {
    "hash_algorithm": "hmac-sha256",
    "key_version": 1,
    "repo_hash":   "7a9c6e4b8f2d1a3c5b7e9f0d2a4c6e8b0d2f4a6c8e0b2d4f6a8c0e2b4d6f8a0c",
    "commit_hash": "3f5d7b9e1c0a2f4d6b8e0a2c4f6d8b0e2a4c6f8d0b2e4a6c8f0d2b4e6a8c0f2d",
    "branch_hash": "1e3c5a7f9d1b3e5c7a9f1d3b5e7c9a1f3d5b7e9c1a3f5d7b9e1c3a5f7d9b1e3c",
    "detector": "blazer-claude-plugin",
    "detector_version": "0.3.1"
  },
  "languages": [
    { "id": "ruby",       "percent": 78.4, "confidence": 1.0 },
    { "id": "javascript", "percent": 9.1,  "confidence": 1.0 },
    { "id": "html",       "percent": 8.2,  "confidence": 1.0 },
    { "id": "scss",       "percent": 4.3,  "confidence": 1.0 }
  ],
  "packages": [
    { "purl": "pkg:gem/rails@8.1.3",            "scope": "runtime", "direct": true, "manifest": "blazer-rails/Gemfile", "confidence": 1.0 },
    { "purl": "pkg:gem/phlex-rails@2.0.1",      "scope": "runtime", "direct": true, "manifest": "blazer-rails/Gemfile", "confidence": 1.0 },
    { "purl": "pkg:gem/tailwindcss-rails@4.0.0","scope": "runtime", "direct": true, "manifest": "blazer-rails/Gemfile", "confidence": 1.0 },
    { "purl": "pkg:gem/pg@1.5.9",               "scope": "runtime", "direct": true, "manifest": "blazer-rails/Gemfile", "confidence": 1.0 },
    { "purl": "pkg:gem/solid_queue@1.0.0",      "scope": "runtime", "direct": true, "manifest": "blazer-rails/Gemfile", "confidence": 1.0 },
    { "purl": "pkg:gem/action_policy@0.7.1",    "scope": "runtime", "direct": true, "manifest": "blazer-rails/Gemfile", "confidence": 1.0 },
    { "purl": "pkg:gem/omniauth@2.1.2",         "scope": "runtime", "direct": true, "manifest": "blazer-rails/Gemfile", "confidence": 1.0 },
    { "purl": "pkg:gem/blueprinter@1.1.0",      "scope": "runtime", "direct": true, "manifest": "blazer-rails/Gemfile", "confidence": 1.0 },
    { "purl": "pkg:gem/rack-attack@6.7.0",      "scope": "runtime", "direct": true, "manifest": "blazer-rails/Gemfile", "confidence": 1.0 },
    { "purl": "pkg:gem/minitest@5.22.0",        "scope": "test",    "direct": true, "manifest": "blazer-rails/Gemfile", "confidence": 1.0 }
  ],
  "facets": {
    "runtime":         [{ "id": "otel:ruby",          "version": "3.4.9", "confidence": 1.0, "evidence_refs": [0] }],
    "framework":       [{ "id": "purl:pkg:gem/rails", "version": "8.1.3", "confidence": 1.0, "evidence_refs": [0] }],
    "package_manager": [{ "id": "cncf:bundler",       "confidence": 1.0, "evidence_refs": [0] }],
    "ci_cd":           [{ "id": "cncf:github-actions", "confidence": 1.0, "evidence_refs": [1] }],
    "iac":             [{ "id": "cncf:kamal",          "confidence": 0.9, "evidence_refs": [2] }],
    "container_build": [{ "id": "cncf:docker",         "confidence": 1.0, "evidence_refs": [3] }],
    "datastore":       [{ "id": "purl:pkg:generic/postgres", "confidence": 1.0, "evidence_refs": [4] }],
    "cache":           [{ "id": "purl:pkg:generic/solid-cache", "confidence": 0.95, "evidence_refs": [5] }],
    "messaging":       [{ "id": "purl:pkg:generic/solid-queue", "confidence": 0.95, "evidence_refs": [5] }],
    "auth":            [
      { "id": "purl:pkg:gem/omniauth",       "confidence": 1.0, "evidence_refs": [0] },
      { "id": "purl:pkg:generic/rails-auth", "confidence": 0.8, "evidence_refs": [6] }
    ],
    "testing":         [{ "id": "purl:pkg:gem/minitest", "confidence": 1.0, "evidence_refs": [0] }]
  },
  "evidence": [
    { "type": "manifest",     "source": "blazer-rails/Gemfile",                     "matched": "gem 'rails', '~> 8.1.3'",              "supports": ["runtime", "framework", "package_manager", "testing", "auth"] },
    { "type": "file",         "source": ".github/workflows/ci.yml",                 "matched": "uses: actions/checkout@v4",             "supports": ["ci_cd"] },
    { "type": "file",         "source": "config/deploy.yml",                        "matched": "kamal deploy config",                   "supports": ["iac"] },
    { "type": "file",         "source": "Dockerfile",                               "matched": "FROM ruby:3.4.9-slim",                  "supports": ["container_build", "runtime"] },
    { "type": "manifest",     "source": "blazer-rails/config/database.yml",         "matched": "adapter: postgresql",                   "supports": ["datastore"] },
    { "type": "content_match","source": "blazer-rails/config/application.rb",       "matched": "config.solid_queue",                    "supports": ["messaging", "cache"] },
    { "type": "content_match","source": "blazer-rails/app/models/user.rb",          "matched": "has_secure_password",                   "supports": ["auth"] }
  ],
  "archetypes": [
    {
      "id": "rails-monolith",
      "confidence": 1.0,
      "matched_predicates": ["runtime", "framework", "packages"],
      "evidence_refs": [0]
    },
    {
      "id": "kubernetes-microservice",
      "confidence": 0.0,
      "matched_predicates": [],
      "evidence_refs": []
    }
  ],
  "notes": "Self-fingerprint of the Blazer monorepo (blazer-rails component). Solid Queue and Solid Cache are represented as generic purls since they are part of Rails 8 core rather than separate packages."
}
